target_group,replic,reply_1,reply_2,outputs
мужчины,"Виртуальный пиздобол. Причем неприятный и не любимый теми же сашами, пашами и димами. Хотя да время летит. Лева из поселка ларина на круслере тут появился весной 2020, когда был первый локдаун. Два года уже. А чел на альфе был за несколько лет до него.","""круслере тут появился весной 2020""? Чел из сарайчика ога, он сначала только с Ромио общался, а потом стал пруфать свой лайф и манькам с него начало нибонбить.А круслеры вроде массово начали мелькать с позапрошлой осени.А до того здесь был кажется активно визгливый андрей прикольный и умная тян из эстонии, с ними было весело. А потом настал культ Паши. Мне все норм, лишьбы сергио пидор не пришел.","Вот так начнёшь вспоминать историю чата - и уверуешь в переселение душ! У меня все эти саши-паши-димы-то путаются, а того, кто на альфе, я уже вообще не помню. Я может позже пришёл? Или просто он был не очень ярким персом? Ты чаще появлялся, тебе судить проще. Так как? Может, тебе вообще поручить историю чата написать, томиков на 70 наберётся, нет? За столько-то лет всего накопилось.",1
лгбт,Тайсон Нормальный Тайсон - чёрный. А чёрный это раб. А Спартак это раб и пидорас. Ккккомбо,"Воу воу давайте уж на тайсона то не гнать, всё-таки великий человек, многого за жизнь добился, не говоря уж о спартаке","""раб и пидорас""? Гомосолдат за цскал",2
другое,"Вся суть. Ты - убогий неудачник, проигравший по жизни. У тебя нет ни друзей, ни увлечений, и единственное твоё развлечение - попытаться причинить кому-то боль. Что у тебя кстати плохо получается, и ты часто сам уходишь с разорванной жопой. Мощно тебе бомбит. Но ты тiрпи.","Отлично написано. Если бы это ещё было правдой, вообще б ништяк. Но увы, в точку ты не попал. Попробуй ещё раз!","НIВIРЮ! Не удивлен что тебя модер потер, такой то ты дегенерат безголовый. Сейчас и тут потрет.",2
лгбт,"Из-за тебя мувач дерьмо, пидрила инцельская.",Какого хера ты обвиняешь во всем меня?,"Из-за тебя мувач дерьмо, пидрила инцельская. Не из-за меня, не гони, пупа.",2
другое,"Кеша, конечно, охуенный, но блядь.1. Самым свежим почти 20 лет.2. Выжатые нахуй.3. Не предназначен для езды по бездорожью ВНЕЗАПНО.4. Те что тюнили под бездор отжаты ещё сильнее.5. Биба и Боба Расход и Налох опционально, некоторые таможены под С.6. Те что на газу - охаркивают двигло через выхлопную. Ябнестал. Даже при моей любви к большим мурриканцам.",таможены под С. Занчит ли это что ему нужен тахограф и прочая хуйня как некоторым хитрожопым на тундрах и f250?,"Нет, это овно мы брать не будем. Нам такие тачки ни к чему, мы на отечественном тазике пока поездим",1
женщины,"Ну тут 1 в 1 ситуация с большевиками в 20е и 30-е годы Сначала выпилили эсеров и прочих полезных дурачков, потом и старую гвардию большевиков Вот и тут, Роулинг попала под руку западным необольшевикам, хотя раньше была в их авангарде Абсолютно не жалко эту тупую пизду","ты прав, но мне её по-человечески жалко, потому что блядь не звать её в такой фильм - ну это чистое же хамство. но поддерживать абсурдные тезисы дегенератов и популяризировать их - и быть повешенным ими же на первом же деревце, это справедливо, да","При чём тут жалость. Когда кто-то попадает под шквал неадекватных комментов, это как минимум несправедливо, а как максимум, угрожает всем остальным, потому что любой может попасть под такой же шквал неадекватных комментов. А жалко у пчёлки, это все знают",1
женщины,а у нее откуда туфли ебанько с бошкой пробитой на которой вши ебутся не квоть меня свинообраз сумашедший,"тогда я взял твои туфли вова , и разбил ей морду в кровь АЪХХААХАХХААХАХА ПРОСТО пилменивая дура !","Не завидуй, у каждой в гардеробе найдутся такие туфли, и не одна пара. Нужно же показать себя разной!",1
женщины,"чел, если он написал трачу 1кк$$ в месяц на шлюх, то это похуй, но тут он пытается покупку шлюхи выставить чуть ли не полноценными отношениями, вот и все какие отношения пиздатые у него","У меня есть опыт покупки шлюх и есть опыт отношений в 14-15 лет когда нет денег в формуле. Я чётко понимаю разницу между покупкой секса и отношениями. А какой опыт есть у тебя? Опыт написания постов на пд и всё? Я не понимаю почему 2 дауна-инцела мухомор и ковёр пытаются кому-то давать советы. Почему вы не можете молча гнить, нахуя вы воняете","Пусть пытается сделать что угодно, нам-то что? Если он нашёл свою королеву, пусть живёт с ней и радуется, нам же спокойнее, со всеми остальными королевами у нас есть шанс! Но ты серьёзно думаешь, он так развонялся потому, что считает свои отношения такими охуенными? Когда счастливы, помалкивают, счастье любит тишину. Не? Не думал?",1
другое,"Оксанка не только строчки у Славяна пиздит, но и диагноз сбайтила? Кек. Жирухи-то, походу, не в ту сторону думают - это Окс к Славе неравнодушен.","Хуя ты фанфики строчишь. Жиду похуй на говнова, он не будет дарить хайп нищему обоссышу.","Вот эти ваши разборки в мире рэпа и хайпа, не думаю что она бы на такое пошла",1
женщины,"лучшая жена - это бывшая проститутка? в рот я ебал такое счастье. любой может сказать, что он живет счастливо, потому что планка у всех разная. Но родить детей от шлюхи? не знаю что тут счастливого может быть. Ей в рот кончали, а она потом будет твоих детей целовать.","Вот привередливый. Как будто не помнишь, откуда на свет появился. Женщина прекрасна во всём и всегда",Подпишись где-нибудь что твоя не шлюха условная в рот не брала и на этом закончим,2
женщины,"Хз но его славочмоха реально боится, а так это как я понял какой-то челик с зепловаа че меня бояться-то, я всего-то пару раз анально уничтожил местных долбоебок, одну, которая со своими говнодиссами носится, и еще одна, которая сосет селоебуебать я страшный, оказывается, ну лол",Ебать ты и на зеплове славочмоха проткнул жесть ты крут эта шлюха тебя ещё и в треде ищет потом,"Ебать ты крутой! Унизил так унизил. Иди бойфренду своему похвастайся, когда сосать ему будешь, пидор сраный",1
национальность,"У хрусичей жопа по шву расходится, наташи по-факту всегда правильно поступают, каждое решение наташки это благо для ее детей и будущего нации.","Мразь тупая, ты за собой следи. Последний раз хуже любой наташки себя вёл, чмо недоделаное","У каждого человека своё видение, как поступать. Не суди и не судим будешь. ",1
мигранты,"Отправляешь корзинку-скрипача к чуркам Его пиздят ""сам_виноват.jpg"" Я даже спорить не стану. Тебя любой психолог говном накормит.","Как-то ты с ни хрена будущее предсказываешь. По кофейной гуще гадаешь. Никто будущего не предскажет, кого кто и куда отправляет. А психологи тоже люди. Кого говном накормят, кому конфетку дадут. Если ты к ним с ноги, то и они тебе ногой. Жиза! ","Психолог тебя проверит перед поступлением на службу, а так же психиатр, и другие врачи. Не кидайся с крайности в крайность. Чурки тебя и на гражданке могут напиздить, корзинку. И даже с большей долей вероятности, и с большей долей вероятности безответственности за это.",2
женщины,"Женщина вполне может быть и проституткой, и кодомакакой. Это почти одно и то же.","Обидно, когда программистов кодомакаками называют, мы ж всё-таки каждый день стараемся сделать мир лучше",Ну для мужчины быть кодомакакой гораздо зашкварнее чем проституткой как по мне. Даже чем гей-проституткой.,2
другое,"Чёта она очень плохо для своих лет выглядит, учитывая какой сука секси была в молодости.","Возраст, к сожалению, мало кого красит, тем более мы не знаем, что она пережила за эти годы.","""учитывая какой сука секси была в молодости""? Ты же упоротый в говно",2
другое,"просто моё ебало, пока 5 часов слушал его охуительные истории про лучшего правителя россии","Я вообще не способен слушать что-либо 5 часов, у меня обезьяна в голове сразу включается и начинает в литавры бить. Что было после 20-й секунды, никогда не помню. Доктор, меня вылечат, или это навсегдась?","И ты как либеральная терпила все 5 часов молчал и ничего не мог сказать? Я так понимаю леьерахи только в интернете могут выебываться, а в жизни даже 30 летнего фаната дим урича осадить не могут.",2
женщины,"вообще не понимаю гонора на вебкамщиц/онлифанщиц. Ну подарила природа бабенке красивую письку или внешку или и то и другое. Хочет и продает, кого ЭТО ВООБЩЕ ЕБЕТ. Симпы блядь куколды. Как же завидуют петровичи и кузьмичи молодым девочкам","это потому что цена на пизду сверхвысока, могли бы петровичи и кузмичи пойти и бабу выебать, то и не платили бы шлюхам на онлифанс. Скоро из-за онлифанса выебать шлюху будет стоить один биткоин, потому что нахуя шлюхе работать там хуи в себя принимать, если можно раскручивать онлифанс и иметь те же бабки нихуя не делая.","зависть, обычная зависть! ни петровичу, ни кузьмичу не хуя показать на онлифанс, и денег за то, чем их наделила природа, они ни хуя не срубят. вот и ярятся в бессильной злобе, печально облизывая монитор. а иногда этот гон провоцируют конкурентки с онлифанс, если чо. там же тоже войны за деньги идут, и нехилые.",1
другое,"Жопошник здесь только ты, мальчонка с надутой грудкой в попытке казаться большим и грозным. Ты двух разных людей отметил вообще. Лично мне абсолютно похуй на то, у кого там какая трансмиссия, пока они не начинают рассказывать, какая петушиная охуенная. Тогда лениво включаюсь в разговор, периодически постукивая ремонтозависимым запчастезаменоголовым крепчайшей головой увитого мощными венами члена по губам. Они обычно благодарят. Иногда смущаются.","Кто о чем, а пидор о хуях.","""Пять"" по риторике. На словах Лев Толстой!",1
женщины,"Та даже если сторис посвящены Ддамагеру, то с вероятностью 99% она транслирует *смотри как мне без тебя охуенно, лох*.","самый рофл что это его реально блядь задевает сука, 30 лет дурачку","может он говорил ей, что она никого не сможет найти. вот она и пытается вызвать ревность",1
женщины,"Рашка первая по абортам на 1000 женщин и распространению спида, но шлюхами считают хохлух, мда. Там ультраправых много, и кстати онли приличная тянка в нашем классе была хохлуха. Хотя приличных русских тоже не мало. Но хохлушки попроще и подушевнее, зато мои соотечественницы были довольно готичные.","""Рашка первая по абортам на 1000 женщин и распространению спида""? По данным воз? ""но шлюхами считают хохлух""? Ну так и есть","Тут и от среды и от характера зависит. Душевные тян в любой нации есть, как и не особо душевные. А кого кем считают - да пох!",1
другое,"человеческое мясо как наркотик, вызывает кайф и зависимость. Сколько человек ты уже съел? Я для себя интересуюсь, просто хочу разобраться.",А ты? Совсем уже ты пидор поехавший. О таком не пиздят. Ты явно пидор.,Не ел я никаких людей. О чем ты вообще говоришь? Обсуди это с кем-то другим.,1
другое,"Вот открытое окошко. Как твой анус, потрепал немножко?","Давай уже диванон, что как чмо совсем","В голос! Саня, ты в порядке? Ты в порядке? Ты в порядке, Саня?!",1
лгбт,Я тут причем? Проблемы подсоса,"И действительно, причем же тут ты со своим комментарием?!","Просто, у пидорас с ориентацие в пространстве trouble,травишь его",2
женщины,"Нищее всратое быдло ставят ниже последней старой трипперной шлюхи, лал.","Старая трипперная шлюха подохнет в муках, потому что нет денег на лекарства. А ебать ее никто не будет, потому что она триппернаяю",Много о триппере знаешь? Зарабатываешь дохуя? Че тя дегенерата это все так задевает? Болезненные воспоминания немытого очка?,1
лгбт,"А ты старый? Или скорее был ли старым, когда гей шлюхой подрабатывал.","Конечно, старый. Сто годков уже, сто первый пошёл. Помню, при царском режиме спрашивают меня: хочешь подработать? а я говорю: хочу. И так меня в подработку крепко взяли, что до самого развала Союза никак закончить не мог. Так вот тут и оказался, молодняк поучаю","Конечно, я давно же геус престарелус из дома для перестарелых глиномесов капчую, молодняк убежища просвящаю. Мой prolaps давно сбежал и сголодухи повесился, а вкус шоколадной крошки на зубах давно истлел. На самом деле нет. Я начал в 22 где то..",2
женщины,"го просто бухнем. а потом по битникам пройдемся. желательно без баб пиздоватых, учеными доказано, у них мозг на 70% меньше, чем у мужчин, я ебал с попугайчиками бухать","откуда статистика, голубчик? я смотрю, ты самый умный у нас. а про мать ты так же думаешь? пить я с тобой не собираюсь. иди гуляй, вася","а ты когда проституток снимаешь ты им в открытую говоришь "" ты тупая тварь я тя купил соси и уебывай, ты не предназначена ни для чего в жизни кроме этого"" ?",2
другое,"Хотел написать что маэстро новое дно пробивает, но он большинство того что мог пробить уже пробил",Ещё одно подтверждение что стабильность признак мастерства,"В глаза левака дегенерата типа тебя, значит все правильно делает",2
национальность,"гомосолдатка детектед Подумал даг, решив шугануть ухтинского вертухая)",когда ссышься хачей на генетическом уровне,"Ты прав, Аркаша, — твоя жопа шире, срать удобней!",1
женщины,"Эпоха джентри закончилась, нонче решает кровь и личные заслуги.И слава богу. Аристократии быть не должно. Большевиков не люблю, но искренне их ценю за то, что перебили всех блядей и эксплуататоров простого люда. Место аристократа - на виселице.","""перебили всех блядей и эксплуататоров простого люда""? Теперь тебя эксплуатируют вчерашние колхозники, у которых нет никакого чувства причастности к стране. А про блядей я вообще молчу. Лучше стало?большевики были топом в свою эпоху меритократии (до концов 60-х примерно), когда всё оценивалось по делам твоим и спрашивалось соответственно","Да не будет никакой аристократии, откуда ей взяться! А что решает кровь - это как раз к теме аристократии ващет. Так что какие-то двойные стандарты у тебя. Датчики не настроены. Перенастрой аппаратурку-то. А то эксплуататоры из низов за тебя покрепче любых листократов возьмутся да ноги из тебя нахуй повыдергают",1
мужчины,Наитупейшая свинья я на морфе играл можешь кстати напомНиТь с чьей линии тинкер вышел без смертей вс бруды Мидовое 3900 ранг играющее на бруде жВВВВВ да спустя два года (месяца) захожу и макаю твою морду в какашки в прочем ниче нового для тебя еблан со всеми возможными дефектами речи,"Да ты разоряться-то погоди да про тинкер напоминать! У тебя, меж прочим, тоже заслуг не вагон, так ими кидаться. А дефектов речи у тебя, чурка, больше, чем у меня, картавое ты шепелявое заикастое чуречелло! Морду он мою макать повадился, где макнёшь там и слижешь!",такая тема шлюший сын ты полтара метровый выблядок ни разу со школы без харчков на спине не вышел за всю жизнь ебучий ублюдок я пустую линию стоял а не против тинкера калоый сгусток нахуй убей себя с 6000 тупейшая сволочь,2
